phenotype	traits	gene_id	gene	description	all_publication	pubmed_id	title	snp	observed_genotype	variation_support_paper	clinical_significance
"Autoimmune Disorders"	"Pemphigus Foliaceus"	10219	KLRG1	"Killer cell lectin-like receptor subfamily G member 1 (KLRG1) gene is in the natural killer (NK) cell complex (NKC) in the chromosomal region 12p13.The protein encoded by this gene belongs to the killer cell lectin-like receptor (KLR) family, which is a g"	https://www.ncbi.nlm.nih.gov/pubmed?LinkName=gene_pubmed&from_uid=10219	PMID: 23238918	"Genome-wide pathway analysis of a genome-wide association study on multiple sclerosis"	rs669	T>C	https://pubmed.ncbi.nlm.nih.gov/23238918/	NA
"Autoimmune Disorders"	Vitiligo	26191	PTPN22	"Protein tyrosine phosphatase non-receptor type (PTPN22) gene is mapped in the chromosomal region 1p13.3–p13.1. It codes for the phosphoprotein named lymphoid tyrosine phosphatase (LYP). This intracellular phosphatase acts as a suppressor of C-terminal S"	https://www.ncbi.nlm.nih.gov/pubmed?LinkName=gene_pubmed&from_uid=26191	"PMID: 20560680"	"Clinical characteristics and PTPN22 1858C/T variant analysis in Jordanian Arab vitiligo patients"	"rs2476601 "	"A>G,T "	https://pubmed.ncbi.nlm.nih.gov/20560680/	https://www.ncbi.nlm.nih.gov/clinvar/variation/8909/
"Autoimmune Disorders"	Vitiligo	22861	"Near NLRP1"	"Studies have associated variations in the NLRP1 gene with an increased risk of vitiligo. One of the NLRP1 gene variations associated with vitiligo changes the amino acid leucine to the amino acid histidine at position 155 in the NLRP1 protein sequence, wr"	https://www.ncbi.nlm.nih.gov/pubmed?LinkName=gene_pubmed&from_uid=22861	"PMID: 29152150"	"Meta-analysis of the association between NLRP1 polymorphisms and the susceptibility to vitiligo and associated autoimmune diseases"	"rs12150220 "	A>T 	https://pubmed.ncbi.nlm.nih.gov/29152150/	https://www.ncbi.nlm.nih.gov/clinvar/variation/4163/
"Autoimmune Disorders"	Vitiligo	22861	NLRP1	"Studies have associated variations in the NLRP1 gene with an increased risk of vitiligo. One of the NLRP1 gene variations associated with vitiligo changes the amino acid leucine to the amino acid histidine at position 155 in the NLRP1 protein sequence, wr"	https://www.ncbi.nlm.nih.gov/pubmed?LinkName=gene_pubmed&from_uid=22861	"PMID: 29152150"	"Meta-analysis of the association between NLRP1 polymorphisms and the susceptibility to vitiligo and associated autoimmune diseases"	"rs12150220 "	"A>T "	https://pubmed.ncbi.nlm.nih.gov/29152150/	https://www.ncbi.nlm.nih.gov/clinvar/variation/4163/
"Autoimmune Disorders"	Vitiligo	4780	NRF2	"Nuclear factor erythroid - derived 2 - like 2 (Nrf2) is a pivotal transcription factor of the antioxidant response in oxidative stress-related illnesses. Studies have suggested that oxidative stress triggers the degeneration of basal layers of epidermal m"	https://www.ncbi.nlm.nih.gov/pubmed?LinkName=gene_pubmed&from_uid=4780	PMID: 31949055	"Erratum for the Research Article: ""Loci associated with skin pigmentation identified in African populations"" by Nicholas G. Crawford, D. E. Kelly, M. E. B. Hansen, M. H. Beltrame, S. Fan, S. L. Bowman, E. Jewett, A. Ranciaro, S. Thompson, Y. Lo, S. P. Pfe"	rs1057519920	C>A,G,T	https://pubmed.ncbi.nlm.nih.gov/31949055/	NA
"Autoimmune Disorders"	Vitiligo	64375	IKZF4	"Studies demonstrated that the combining genetic and immunological pathways might lead to lymphocyte destruction and vitiligo with immune-related diseases. IKZF4 encoding Eos, a zinc finger transcription factor of the Ikaros family, is expressed in lymphoc"	https://www.ncbi.nlm.nih.gov/pubmed?LinkName=gene_pubmed&from_uid=64375	"PMID: 22951725"	"Association analyses identify three susceptibility Loci for vitiligo in the Chinese Han population"	rs10876864	G>A,T	https://pubmed.ncbi.nlm.nih.gov/22951725/	NA
"Chronic Inflammatory Conditions"	Eczema	11005	SPINK5	"SPINK5 encodes a serine protease inhibitor that is responsible for Netherton syndrome, a rare genetic disorder that includes the features of atopic eczema. Dysfunction of SPINK5 may result in abnormal keratinocyte differentiation and disturbed skin barrie"	https://www.ncbi.nlm.nih.gov/pubmed?LinkName=gene_pubmed&from_uid=11005	PMID: 21087323	"Hint for association of single nucleotide polymorphisms and haplotype in SPINK5 gene with atopic dermatitis in Koreans"	rs2303064	G>A,C,T	https://pubmed.ncbi.nlm.nih.gov/21087323/	https://www.ncbi.nlm.nih.gov/clinvar/variation/139258/
"Chronic Inflammatory Autoimmune Conditions"	Psoriasis	3586	IL10	"IL-10 is an anti-inflammatory and immunosuppressive cytokine that plays a significant role in the regulation of immune responses. The human IL-10 gene is positioned in the chromosome region 1q31–q32. The relative deficiency of the anti-inflammatory cyto"	https://www.ncbi.nlm.nih.gov/pubmed?LinkName=gene_pubmed&ncbi_mmode=std&from_uid=3586	"PMID: 29696068"		rs1800896	"T>C "	https://pubmed.ncbi.nlm.nih.gov/29696068/	NA
"Chronic Inflammatory Autoimmune Conditions"	Psoriasis	149233	IL23R	"IL-23 supports the proliferation and survival of Th17 cells. Th17 cells may play an important role in maintaining chronic inflammation in psoriasis, Crohn disease, and other autoinflammatory conditions. The fact that common alleles at IL12B and/or IL23R c"	https://www.ncbi.nlm.nih.gov/pubmed?LinkName=gene_pubmed&from_uid=149233	"PMID: 31701644"	"Association analysis of interleukin-23 receptor SNPs and SAPHO syndrome in Chinese people"	"rs10889677 "	"C>A,T "	https://pubmed.ncbi.nlm.nih.gov/31701644/	
"Chronic Inflammatory Autoimmune Conditions"	Psoriasis	10758	TRAF3IP2	"TRAF3IP2 protein is involved in inflammatory pathways, including cytokine signaling. This gene encodes a protein involved in regulating responses to cytokines by members of the Rel/NF-kappaB transcription factor family. These factors play a central role i"	https://www.ncbi.nlm.nih.gov/pubmed?LinkName=gene_pubmed&from_uid=10758	"PMID: 30528823"	"Neutrophil Extracellular Traps Induce Human Th17 Cells: Effect of Psoriasis-Associated TRAF3IP2 Genotype"	" rs33980500"	"C>T "	https://pubmed.ncbi.nlm.nih.gov/30528823/	https://www.ncbi.nlm.nih.gov/clinvar/variation/30630/
Photoaging	"Tanning Ability"	7306	"Near TYRP1"	"The TYRP1 gene provides instructions for making an enzyme called tyrosinase-related protein 1. This enzyme is located in melanocytes, which are specialized cells that produce a pigment called melanin."	https://www.ncbi.nlm.nih.gov/pubmed?LinkName=gene_pubmed&from_uid=7306	"PMID: 25837821"	"Inherited genetic variants associated with occurrence of multiple primary melanoma"	rs2733832	"C>A,G,T "	https://pubmed.ncbi.nlm.nih.gov/25837821/	https://www.ncbi.nlm.nih.gov/clinvar/variation/256642/
Photoaging	"Tanning Ability"	4157	NearMC1R	"Melanocortin-1 receptor is an important gene for melanogenesis, and it codes for the G-protein-coupled receptor on melanocytes. The binding of the alpha-melanocyte-stimulating hormone (a-MSH) to the receptor is positively linked to the cAMP-signaling path"	https://www.ncbi.nlm.nih.gov/pubmed?LinkName=gene_pubmed&from_uid=4157	PMID: 31488411	"MC1R Variation in a New Mexico Population"	rs885479	G>A,C	https://pubmed.ncbi.nlm.nih.gov/31488411/	https://www.ncbi.nlm.nih.gov/clinvar/variation/258652/
Photoaging	"Tanning Ability"	51151	SLC45A2	"SLC45A2 (also called MATP) gene encodes a membrane associated transporter protein involved in arranging melanogenic enzymes during melanosome maturation. It has been previously defined as a human pigmentation related and melanoma susceptibility gene. The "	https://www.ncbi.nlm.nih.gov/pubmed?LinkName=gene_pubmed&from_uid=51151	PMID: 27566401	"IRF4 Polymorphism Is Associated with Cutaneous Squamous Cell Carcinoma in Organ Transplant Recipients: A Pigment-Independent Phenomenon"	 rs16891982	C>A,G	https://pubmed.ncbi.nlm.nih.gov/27566401/	https://www.ncbi.nlm.nih.gov/clinvar/variation/197829/
Photoaging	"Tanning Ability"	8924	"HERC2 "	"HERC2 is a giant E3 ubiquitin protein ligase, implicated in DNA repair regulation, pigmentation and neurological disorders. It is encoded by a gene of the same name belonging to the HERC family, which typically encodes large protein products with C-Termin"	https://www.ncbi.nlm.nih.gov/pubmed?LinkName=gene_pubmed&from_uid=8924	PMID: 26286644	"The more the merrier? How a few SNPs predict pigmentation phenotypes in the Northern German population"	"rs12913832 "	A>G	https://pubmed.ncbi.nlm.nih.gov/26286644/	https://www.ncbi.nlm.nih.gov/clinvar/variation/4745/
Photoaging	"Tanning Ability"	4157	MC1R	"Melanocortin-1 receptor is an important gene for melanogenesis, and it codes for the G-protein-coupled receptor on melanocytes. The binding of the alpha-melanocyte-stimulating hormone (a-MSH) to the receptor is positively linked to the cAMP-signaling path"	https://www.ncbi.nlm.nih.gov/pubmed?LinkName=gene_pubmed&from_uid=4157	PMID: 31488411	"MC1R Variation in a New Mexico Population"	rs885479	G>A,C	https://pubmed.ncbi.nlm.nih.gov/31488411/	https://www.ncbi.nlm.nih.gov/clinvar/variation/258652/
Photoaging	"Tanning Ability"	3662	IRF4	"IRF4 gene, encoding a member of a helix-loophelix family of DNA-binding transcription factors involved in downstream regulation of interferon signaling. IRFs are primarily associated with immune system development and response. IRF4 is predominantly expre"	https://www.ncbi.nlm.nih.gov/pubmed?LinkName=gene_pubmed&from_uid=3662	PMID: 31958143	"Association of IRF4 single-nucleotide polymorphism rs12203592 with melanoma-specific survival"	rs12203592	C>T	https://pubmed.ncbi.nlm.nih.gov/31958143/	
Photoaging	"Sun spots"	51151	SLC45A2	"SLC45A2 (also called MATP) gene encodes a membrane associated transporter protein involved in arranging melanogenic enzymes during melanosome maturation. It has been previously defined as a human pigmentation related and melanoma susceptibility gene. The "	https://www.ncbi.nlm.nih.gov/pubmed?LinkName=gene_pubmed&from_uid=51151	PMID: 27566401	"IRF4 Polymorphism Is Associated with Cutaneous Squamous Cell Carcinoma in Organ Transplant Recipients: A Pigment-Independent Phenomenon"	 rs16891982	C>A,G	https://pubmed.ncbi.nlm.nih.gov/27566401/	https://www.ncbi.nlm.nih.gov/clinvar/variation/197829/
Photoaging	"Sun spots"	4157	MC1R	"Melanocortin-1 receptor is an important gene for melanogenesis, and it codes for the G-protein-coupled receptor on melanocytes. The binding of the alpha-melanocyte-stimulating hormone (a-MSH) to the receptor is positively linked to the cAMP-signaling path"	https://www.ncbi.nlm.nih.gov/pubmed?LinkName=gene_pubmed&from_uid=4157	PMID: 31488411	"MC1R Variation in a New Mexico Population"	rs885479	G>A,C	https://pubmed.ncbi.nlm.nih.gov/31488411/	https://www.ncbi.nlm.nih.gov/clinvar/variation/258652/
Photoaging	Sunburns	51151	SLC45A2	"SLC45A2 (also called MATP) gene encodes a membrane associated transporter protein involved in arranging melanogenic enzymes during melanosome maturation. It has been previously defined as a human pigmentation related and melanoma susceptibility gene. The "	https://www.ncbi.nlm.nih.gov/pubmed?LinkName=gene_pubmed&from_uid=51151	PMID: 27566401	"IRF4 Polymorphism Is Associated with Cutaneous Squamous Cell Carcinoma in Organ Transplant Recipients: A Pigment-Independent Phenomenon"	rs16891982	C>A,G	https://pubmed.ncbi.nlm.nih.gov/27566401/	https://www.ncbi.nlm.nih.gov/clinvar/variation/197829/
Photoaging	Sunburns	8924	"HERC2 "	"HERC2 is a giant E3 ubiquitin protein ligase, implicated in DNA repair regulation, pigmentation and neurological disorders. It is encoded by a gene of the same name belonging to the HERC family, which typically encodes large protein products with C-Termin"	https://www.ncbi.nlm.nih.gov/pubmed?LinkName=gene_pubmed&from_uid=8924	PMID: 26286644	"The more the merrier? How a few SNPs predict pigmentation phenotypes in the Northern German population"	"rs12913832 "	A>G	https://pubmed.ncbi.nlm.nih.gov/26286644/	https://www.ncbi.nlm.nih.gov/clinvar/variation/4745/
Photoaging	Sunburns	3662	IRF4	"IRF4 gene, encoding a member of a helix-loophelix family of DNA-binding transcription factors involved in downstream regulation of interferon signaling. IRFs are primarily associated with immune system development and response. IRF4 is predominantly expre"	https://www.ncbi.nlm.nih.gov/pubmed?LinkName=gene_pubmed&from_uid=3662	PMID: 31958143	"Association of IRF4 single-nucleotide polymorphism rs12203592 with melanoma-specific survival"	rs12203592	C>T	https://pubmed.ncbi.nlm.nih.gov/31958143/	https://www.ncbi.nlm.nih.gov/clinvar/variation/160346/
Photoaging	Sunburns	4157	MC1R	"Melanocortin-1 receptor is an important gene for melanogenesis, and it codes for the G-protein-coupled receptor on melanocytes. The binding of the alpha-melanocyte-stimulating hormone (a-MSH) to the receptor is positively linked to the cAMP-signaling path"	https://www.ncbi.nlm.nih.gov/pubmed?LinkName=gene_pubmed&from_uid=4157	PMID: 31488411	"MC1R Variation in a New Mexico Population"	rs885479	G>A,C	https://pubmed.ncbi.nlm.nih.gov/31488411/	https://www.ncbi.nlm.nih.gov/clinvar/variation/258652/
"Morphology and Texture"	ALOPECIA	367	AR	"'The androgen receptor gene is more than 90 kb long and codes for a protein that has 3 major functional domains: the N-terminal domain, DNA-binding domain, and androgen-binding domain. The protein functions as a steroid-hormone activated transcription fac"	https://pubmed.ncbi.nlm.nih.gov/24665929/	"PMID: 24665929"	"Androgenetic alopecia and polymorphism of the androgen receptor gene (SNP rs6152) in patients with benign prostate hyperplasia or prostate cancer"	rs6152	G>A	https://www.ncbi.nlm.nih.gov/snp/rs6152#publications	https://www.ncbi.nlm.nih.gov/clinvar?term=((165512[AlleleID]))
"Morphology and Texture"	"Freckles "	4157	MC1R	"This intronless gene encodes the receptor protein for melanocyte-stimulating hormone (MSH). The encoded protein, a seven pass transmembrane G protein coupled receptor, controls melanogenesis. Two types of melanin exist: red pheomelanin and black eumelanin"	https://pubmed.ncbi.nlm.nih.gov/23744330/	PMID: 8894704	"The Asp84Glu variant of the melanocortin 1 receptor (MC1R) is associated with melanoma"	rs1805006	C>A,G	https://pubmed.ncbi.nlm.nih.gov/8894704/	https://www.ncbi.nlm.nih.gov/clinvar?term=((227383[AlleleID]))
"Morphology and Texture"	"Skin color "	283652	SLC24A5	"This gene is a member of the potassium-dependent sodium/calcium exchanger family and encodes an intracellular membrane protein with 2 large hydrophilic loops and 2 sets of multiple transmembrane-spanning segments. Sequence variation in this gene has been "	https://www.ncbi.nlm.nih.gov/pubmed?LinkName=gene_pubmed&from_uid=283652	"PMID 16847698"	"Population differences of two coding SNPs in pigmentation-related genes SLC24A5 and SLC45A2"	rs1426654	"A>G / A>T"	https://www.ncbi.nlm.nih.gov/snp/rs1426654#publications	https://www.ncbi.nlm.nih.gov/clinvar?term=((16526[AlleleID])OR(255247[AlleleID]))
"Morphology and Texture"	"Hair color "	4254	KITLG	"This gene encodes the ligand of the tyrosine-kinase receptor encoded by the KIT locus. This ligand is a pleiotropic factor that acts in utero in germ cell and neural cell development, and hematopoiesis, all believed to reflect a role in cell migration. In"	https://www.ncbi.nlm.nih.gov/pubmed/23548203?dopt=Abstract	"PMID 30531825"	"Genome-wide study of hair colour in UK Biobank explains most of the SNP heritability."	rs12821256	"T>A / T>C / T>G"	https://www.ncbi.nlm.nih.gov/snp/rs12821256#publications	https://www.ncbi.nlm.nih.gov/clinvar?term=((27850[AlleleID]))
"Morphology and Texture"	"Hair color "	4157	MC1R	"This intronless gene encodes the receptor protein for melanocyte-stimulating hormone (MSH). The encoded protein, a seven pass transmembrane G protein coupled receptor, controls melanogenesis. Two types of melanin exist: red pheomelanin and black eumelanin"	https://www.ncbi.nlm.nih.gov/pubmed?LinkName=gene_pubmed&from_uid=4157	"PMID 31488411"	"Variant associated with red hair and poor tanning ability in one study [PMID 7581459]"	rs1805009	G>A,C	https://www.ncbi.nlm.nih.gov/snp/rs1805009#publications	https://www.ncbi.nlm.nih.gov/clinvar?term=((29346[AlleleID]))
"Morphology and Texture"	"Striae Distensae"	83872	HMCN1	"HMCN1 codes for Hemicentin 1. This gene encodes a large extracellular member of the immunoglobulin superfamily. Mutations in this gene may be associated with age-related macular degeneration."	https://www.ncbi.nlm.nih.gov/pubmed?LinkName=gene_pubmed&from_uid=83872	PMID: 21609220	"Genetics of age-related macular degeneration: current concepts, future directions"	rs35856562	A>G	https://pubmed.ncbi.nlm.nih.gov/21609220/	https://www.ncbi.nlm.nih.gov/clinvar/variation/781796/
"Morphology and Texture"	"Striae Distensae"	2006	"Near ELN"	"ELN gene codes for Elastin. Elastin is the major component of elastic fibers, which provide reversible extensibility to connective tissue. Mutations in elastin that result in a loss of mature elastin can lead to autosomal dominant cutis laxa (a condition "	https://www.ncbi.nlm.nih.gov/pubmed?LinkName=gene_pubmed&from_uid=2006	PMID: 29129841	"Genetic Risk Assessment of Elastin Gene Polymorphisms with Intracranial Aneurysm in Koreans"	rs2071307 	G>A,C 	https://pubmed.ncbi.nlm.nih.gov/29129841/	https://www.ncbi.nlm.nih.gov/clinvar/variation/569280/
"Morphology and Texture"	Acne	7124	"Near TNF"	"Proinflammatory cytokines such as interleukin (IL)-1, IL-8 and tumour necrosis factor (TNF) contribute to the pathogenesis of acne. TNF has a pivotal role in inflammatory reactions and is a key regulator of the innate immune system. The inflammatory respo"	https://www.ncbi.nlm.nih.gov/pubmed?LinkName=gene_pubmed&from_uid=7124	"PMID: 32700971"	"Association of TNF-α-308 (G >A) (rs1800629) Gene Polymorphism with Adverse Outcomes of Sepsis in Critically Ill Patients"	"rs1800629 "	"G>A "	https://pubmed.ncbi.nlm.nih.gov/32700971/	https://www.ncbi.nlm.nih.gov/clinvar/variation/225964/
"Morphology and Texture"	Acne	7124	TNF	"Proinflammatory cytokines such as interleukin (IL)-1, IL-8 and tumour necrosis factor (TNF) contribute to the pathogenesis of acne. TNF has a pivotal role in inflammatory reactions and is a key regulator of the innate immune system. The inflammatory respo"	https://www.ncbi.nlm.nih.gov/pubmed?LinkName=gene_pubmed&from_uid=7124	"PMID: 32700971"	"Association of TNF-α-308 (G >A) (rs1800629) Gene Polymorphism with Adverse Outcomes of Sepsis in Critically Ill Patients"	"rs1800629 "	"G>A "	https://pubmed.ncbi.nlm.nih.gov/32700971/	https://www.ncbi.nlm.nih.gov/clinvar/variation/225964/
"Morphology and Texture"	Acne	4609	"Near MYC"	"The closest gene around the chromosome 8q24 region is MYC, which has been known as a proto-oncogene and is a particularly compelling candidate in this region. Of interest, Myc has also been reported to regulate the androgenic effect. A Myc consensus site "	https://www.ncbi.nlm.nih.gov/pubmed?LinkName=gene_pubmed&from_uid=4609	PMID: 8220424	"'A Functional 5''-UTR Polymorphism of MYC Contributes to Nasopharyngeal Carcinoma Susceptibility and Chemoradiotherapy Induced Toxicities'"	rs28933407	C>T 	https://pubmed.ncbi.nlm.nih.gov/8220424/	https://www.ncbi.nlm.nih.gov/clinvar/variation/12574/
"Morphology and Texture"	Acne	6402	"Near SELL"	"This gene encodes a cell surface adhesion molecule (selectins) that belongs to a family of adhesion/homing receptors.These selectins of adhesion molecules have important roles in regulating homoeostasis and cutaneous inflammation. L-selectin is expressed "	https://www.ncbi.nlm.nih.gov/pubmed?LinkName=gene_pubmed&from_uid=6402	PMID: 19240957	"Candidate gene analysis of selectin cluster in patients with multiple sclerosis"	rs2229569	G>A,T	https://pubmed.ncbi.nlm.nih.gov/19240957/	NA
