phenotype	traits	gene_id	gene	description	all_publication	pubmed_id	title	snp	observed_genotype	variation_support_paper	clinical_significance
Diabetes	"Diabetic Retinopathy"	7351	UCP2	"The uncoupling protein 2 (UCP2) is a member of the mitochondrial inner membrane carrier family and is expressed in many tissues including white adipose tissue, liver, kidney, pancreatic islets, macrophages and retinal endothelial cells and pericytes. UCP2"	https://www.ncbi.nlm.nih.gov/pubmed?LinkName=gene_pubmed&from_uid=7351	"PMID: 25396419"	"Investigation of variants in UCP2 in Chinese type 2 diabetes and diabetic retinopathy"	rs660339	"G>A "	https://pubmed.ncbi.nlm.nih.gov/25396419/	https://www.ncbi.nlm.nih.gov/clinvar/variation/130697/
Diabetes	"Diabetic Retinopathy"	3075	CFH	"'The CFH gene provides instructions for making a protein called complement factor H. This protein helps regulate a part of the body''s immune response known as the complement system. The complement system is a group of proteins that work together to destr"	https://www.ncbi.nlm.nih.gov/pubmed?LinkName=gene_pubmed&ncbi_mmode=std&from_uid=3075	"PMID: 23864767"	"Association of CFH and CFB gene polymorphisms with retinopathy in type 2 diabetic patients"	rs800292	"G>A "	https://pubmed.ncbi.nlm.nih.gov/23864767/	https://www.ncbi.nlm.nih.gov/clinvar/variation/16550/
Diabetes	"Diabetic Retinopathy"	629	CFB	"This gene encodes complement factor B, a component of the alternative pathway of complement activation. Factor B circulates in the blood as a single chain polypeptide. Upon activation of the alternative pathway, it is cleaved by complement factor D yieldi"	https://www.ncbi.nlm.nih.gov/pubmed?LinkName=gene_pubmed&from_uid=629	"PMID: 23864767"	"Association of CFH and CFB gene polymorphisms with retinopathy in type 2 diabetic patients"	rs1048709	"A>G,T "	https://pubmed.ncbi.nlm.nih.gov/23864767/	https://www.ncbi.nlm.nih.gov/clinvar/variation/356272/
Diabetes	"Diabetic Retinopathy"	7040	TGFB1	"This gene encodes a secreted ligand of the TGF-beta (transforming growth factor-beta) superfamily of proteins. Ligands of this family bind various TGF-beta receptors leading to recruitment and activation of SMAD family transcription factors that regulate "	https://www.ncbi.nlm.nih.gov/pubmed?LinkName=gene_pubmed&from_uid=7040	"PMID: 29115286"	"Genetic predictors associated with diabetic retinopathy in patients with diabetic foot"	rs1800469	A>G	https://pubmed.ncbi.nlm.nih.gov/29115286/	https://www.ncbi.nlm.nih.gov/clinvar/variation/39302/
Diabetes	"Diabetic Retinopathy"	6347	"Near CCL2"	"Hyperglycemia accelerates MCP1 production in vascular endothelial cells and retinal pigmented epithelial cells. Moreover, the levels of MCP1 in aqueous and vitreous conditions were significantly increased in patients with diabetic retinopathy. production "	https://www.ncbi.nlm.nih.gov/pubmed?LinkName=gene_pubmed&from_uid=6347	"PMID: 27472286"	"CCL2, CCL5, IL4 and IL15 Gene Polymorphisms in Women with Gestational Diabetes Mellitus"	 rs1024611	"A>G "	https://pubmed.ncbi.nlm.nih.gov/27472286/	https://www.ncbi.nlm.nih.gov/clinvar/variation/14207/
Diabetes	"Type II Diabetes"	79068	FTO	"This gene is a nuclear protein of the AlkB related non-haem iron and 2-oxoglutarate-dependent oxygenase superfamily but the exact physiological function of this gene is not known. Other non-heme iron enzymes function to reverse alkylated Diabetic nephropa"	https://www.ncbi.nlm.nih.gov/pubmed?LinkName=gene_pubmed&from_uid=79068	"PMID: 30074065"	"FTO, GCKR, CDKAL1 and CDKN2A/B gene polymorphisms and the risk of gestational diabetes mellitus: a meta-analysis"	rs9939609	"T>A "	https://pubmed.ncbi.nlm.nih.gov/30074065/	NA
Diabetes	"Type II Diabetes"	6934,	TCF7L2	"This gene encodes a high mobility group (HMG) box-containing transcription factor that plays a key role in the Wnt signaling pathway. The protein has been implicated in blood glucose homeostasis. Genetic variants of this gene are associated with increased"	https://www.ncbi.nlm.nih.gov/pubmed?LinkName=gene_pubmed&from_uid=6934	"PMID: 25498973"	"The type 2 diabetes associated rs7903146 T allele within TCF7L2 is significantly under-represented in Hereditary Multiple Exostoses: insights into pathogenesis"	rs7903146	C>G,T	https://pubmed.ncbi.nlm.nih.gov/25498973/	https://www.ncbi.nlm.nih.gov/clinvar/variation/7413/
Diabetes	"Type II Diabetes"	9370	ADIPOQ	"This gene is expressed in adipose tissue exclusively. It encodes a protein with similarity to collagens X and VIII and complement factor C1q. The encoded protein circulates in the plasma and is involved with metabolic and hormonal processes. Mutations in "	https://www.ncbi.nlm.nih.gov/pubmed?LinkName=gene_pubmed&from_uid=9370	"PMID: 30467975"	"ADIPOQ, KCNJ11 and TCF7L2 polymorphisms in type 2 diabetes in Kyrgyz population: A case-control study"	rs1501299	"G>C,T "	https://pubmed.ncbi.nlm.nih.gov/30467975/	NA
Diabetes	"Type II Diabetes"	54901	CDKAL1	"CDKAL1 gene encode tRNA decoration enzyme, namely methyl transfer enzyme which is responsible for the 2-methylthio-N6-threonylcarbamoyladenosine synthesis of the 37th base of tRNA Lys(UUU). Studies found the mitochondria adenosine triphosphate (ATP) gener"	https://www.ncbi.nlm.nih.gov/pubmed?LinkName=gene_pubmed&from_uid=54901	"PMID: 32228543"	"Obesity-related loci in TMEM18, CDKAL1 and FAIM2 are associated with obesity and type 2 diabetes in Chinese Han patients"	rs7754840	G>A,C,T	https://pubmed.ncbi.nlm.nih.gov/32228543/	https://www.ncbi.nlm.nih.gov/clinvar/variation/812171/
Diabetes	"Type II Diabetes"	3784	KCNQ1	"The KCNQ1 gene encodes the pore-forming A-subunit of the voltage-gated K+ channel (KvLQT1), which plays an important role in controlling the ventricular repolarization process. KCNQ1 (potassium voltage-gated channel, KQT-like subfamily, member 1 gene as a"	https://www.ncbi.nlm.nih.gov/pubmed?LinkName=gene_pubmed&from_uid=3784	"PMID: 32550155"	"KCNQ1 common genetic variant and type 2 diabetes mellitus risk"	rs2237892	C>T	https://pubmed.ncbi.nlm.nih.gov/32550155/	NA
Diabetes	"Type II Diabetes"	3667	IRS1	"Insulin receptor substrate 1 is a substrate of insulin receptor tyrosine kinase, which plays a central role in the insulin-stimulated signal transduction pathway, and acts as a docking protein between the insulin receptor and the signalling molecules."	https://www.ncbi.nlm.nih.gov/pubmed?LinkName=gene_pubmed&from_uid=3667	"PMID: 31446532"	"Genetic association of insulin receptor substrate-1 (IRS-1, rs1801278) gene with insulin resistant of type 2 diabetes mellitus in a Pakistani population"	rs1801278	C>G,T	https://pubmed.ncbi.nlm.nih.gov/31446532/	ncbi.nlm.nih.gov/clinvar/variation/29761/
Diabetes	"Type II Diabetes"	7466	WFS1	"WFS1 encodes wolframin, a transmembrane glycoprotein that maintains calcium homeostasis of the endoplasmic reticulum. Mutations in this gene causes Wolfram syndrome, characterized by diabetes insipidus, juvenile-onset non-autoimmune diabetes mellitus, opt"	https://www.ncbi.nlm.nih.gov/pubmed?LinkName=gene_pubmed&from_uid=7466	"PMID: 31759989"	"Maya gene variants related to the risk of type 2 diabetes in a family-based association study"	rs6446482	C>A,G	https://pubmed.ncbi.nlm.nih.gov/31759989/	https://www.ncbi.nlm.nih.gov/clinvar/variation/4528/
Diabetes	"Type II Diabetes"	169026	"SLC30A8 "	"SLC30A8 encodes the secretory granule-resident and largely endocrine pancreas-restricted zinc transporter ZnT8. This gene encodes a recently identified zinc transporter, ZnT8, whose expression is largely confined to the endocrine pancreas within beta (and"	https://www.ncbi.nlm.nih.gov/pubmed?LinkName=gene_pubmed&from_uid=169026	"PMID: 30197307"	"SLC30A8 Gene rs13266634 C/T Polymorphism in Children with Type 1 Diabetes in Tamil Nadu, India"	rs13266634	C>A,T	https://pubmed.ncbi.nlm.nih.gov/30197307/	https://www.ncbi.nlm.nih.gov/clinvar/variation/1000/
Diabetes	"Type II Diabetes"	10644	IGF2BP2	"Insulin-like growth factor 2 mRNA-binding protein 2 (IGF2BP2) belongs to a family of mRNA-binding proteins involved in RNA localization, stability, and translation. IGF2 plays a pivotal role in regulating fetal growth and organogenesis, including adipogen"	https://www.ncbi.nlm.nih.gov/pubmed?LinkName=gene_pubmed&from_uid=10644	"PMID: 29410390"	"Genes associated with Type 2 Diabetes and vascular complications"	rs4402960	"G>T "	https://pubmed.ncbi.nlm.nih.gov/29410390/	https://www.ncbi.nlm.nih.gov/clinvar/variation/2435/
Diabetes	"Cardiovascular Diseases"	9370	ADIPOQ	"This gene is expressed in adipose tissue exclusively. It encodes a protein with similarity to collagens X and VIII and complement factor C1q. The encoded protein circulates in the plasma and is involved with metabolic and hormonal processes. Mutations in "	https://www.ncbi.nlm.nih.gov/pubmed?LinkName=gene_pubmed&from_uid=9370	"PMID: 30472712"	"Variants in APOA5 and ADIPOQ Moderate Improvements in Metabolic Syndrome during a One-Year Lifestyle Intervention"	rs1501299	"G>C,T "	https://pubmed.ncbi.nlm.nih.gov/30472712/	NA
"Lipid Metabolism"	"Cholesterol Levels"	" 3990,"	LIPC	"LIPC encodes hepatic triglyceride lipase, which is expressed in liver. LIPC has the dual functions of triglyceride hydrolase and ligand/bridging factor for receptor-mediated lipoprotein uptake."	https://www.ncbi.nlm.nih.gov/pubmed?LinkName=gene_pubmed&from_uid=3990	"PMID: 20385826"	"Genome-wide association study of advanced age-related macular degeneration identifies a role of the hepatic lipase gene (LIPC)"	rs493258	T>C	https://pubmed.ncbi.nlm.nih.gov/20385826/	NA
"Lipid Metabolism"	"Cholesterol Levels"	4023	LPL	"This gene encodes for the protein Lipoprotein Lipase. This enzyme breaks down the Triglycerides present in Lipoproteins into free fatty acids."	https://www.ncbi.nlm.nih.gov/pubmed?LinkName=gene_pubmed&from_uid=4023	"PMID: 31877157"	"Associations of systemic, serum lipid and lipoprotein metabolic pathway gene variations with polypoidal choroidal vasculopathy in China"	rs12678919	A>G	https://pubmed.ncbi.nlm.nih.gov/31877157/	NA
"Lipid Metabolism"	"Cholesterol Levels"	341	APOC1	"This gene encodes a member of the apolipoprotein C1 family. This gene is expressed primarily in the liver, and it is activated when monocytes differentiate into macrophages. The encoded protein plays a central role in high density lipoprotein (HDL) and ve"	https://www.ncbi.nlm.nih.gov/pubmed?LinkName=gene_pubmed&from_uid=341	"PMID: 28486432"	"Apolipoprotein C-I Polymorphism and Its Association with Serum Lipid Levels and Longevity in the Bama Population"	rs4420638	"A>G "	https://pubmed.ncbi.nlm.nih.gov/28486432/	https://www.ncbi.nlm.nih.gov/clinvar/variation/162177/
"Lipid Metabolism"	"Cholesterol Levels"	6927	"Near HNF1A"	"Hepatocyte nuclear factor 4α (HNF4α, NR2A1) is a member of the nuclear receptor superfamily. It is highly expressed in the liver, with lower levels in the kidney, intestine and pancreatic β cells. Acute loss of hepatic HNF4α results in striking phenot"	https://www.ncbi.nlm.nih.gov/pubmed?LinkName=gene_pubmed&from_uid=6927	"PMID: 31915469"	"Association of Common Variants in HNF1A Gene with Serum AFP Level in Healthy Chinese Individuals and HCC Patients"	rs2464196	G>A,C	https://pubmed.ncbi.nlm.nih.gov/31915469/	NA
"Lipid Metabolism"	"Cholesterol Levels"	3990	"Near LIPC"	"The LIPC gene provides instructions for making an enzyme called hepatic lipase. This enzyme is produced by liver cells and released into the bloodstream where it helps with the conversion of fat-transporting molecules called very low-density lipoproteins "	https://www.ncbi.nlm.nih.gov/pubmed?LinkName=gene_pubmed&from_uid=3990	"PMID: 20385826"	"Genome-wide association study of advanced age-related macular degeneration identifies a role of the hepatic lipase gene (LIPC)"	rs493258	T>C	https://pubmed.ncbi.nlm.nih.gov/20385826/	NA
"Lipid Metabolism"	"Cholesterol Levels"	1952	CELSR2	"The protein encoded by this gene is a member of the flamingo subfamily, part of the cadherin superfamily. The flamingo subfamily consists of nonclassic-type cadherins; a subpopulation that does not interact with catenins. The flamingo cadherins are locate"	https://www.ncbi.nlm.nih.gov/pubmed?LinkName=gene_pubmed&from_uid=1952	"PMID: 26464717"	"Association of variants in CELSR2-PSRC1-SORT1 with risk of serum lipid traits, coronary artery disease and ischemic stroke"	rs599839	G>A,C,T	https://pubmed.ncbi.nlm.nih.gov/26464717/	NA
"Lipid Metabolism"	"Triglyceride Levels"	116519	APOA5	"Encodes Apolipoprotein A-5, major component of VLDL, Chylomicrons, HDL. APOA5 functions as an activator of lipoprotein lipase ( key enzyme in triglyceride catabolism) and inhibits hepatic VLDL-particle production and assembly (by binding to cellular membr"	https://www.ncbi.nlm.nih.gov/pubmed?LinkName=gene_pubmed&from_uid=9388	"PMID: 26365669"	"Interaction of dietary fat intake with APOA2, APOA5 and LEPR polymorphisms and its relationship with obesity and dyslipidemia in young subjects"	rs662799	"G>A,C "	https://pubmed.ncbi.nlm.nih.gov/26365669/	https://www.ncbi.nlm.nih.gov/clinvar/variation/548114/
"Lipid Metabolism"	"Triglyceride Levels"	4023	LPL	"LPL is an important rate-limiting enzyme for the hydrolysis of circulating Triglyceride, found in chylomicrons and Very Low Density Lipoprotein, into non-esterified fatty acids and 2-monoacylglycerol for tissue utilization and High density Lipoprotein for"	https://www.ncbi.nlm.nih.gov/pubmed?LinkName=gene_pubmed&from_uid=4023	"PMID: 31877157"	"Associations of systemic, serum lipid and lipoprotein metabolic pathway gene variations with polypoidal choroidal vasculopathy in China"	rs12678919	A>G	https://pubmed.ncbi.nlm.nih.gov/31877157/	NA
"Lipid Metabolism"	"Triglyceride Levels"	341	APOC1	"This gene encodes a member of the apolipoprotein C1 family. This gene is expressed primarily in the liver, and it is activated when monocytes differentiate into macrophages. The encoded protein plays a central role in high density lipoprotein (HDL) and ve"	https://www.ncbi.nlm.nih.gov/pubmed?LinkName=gene_pubmed&from_uid=341	"PMID: 28486432"	"Apolipoprotein C-I Polymorphism and Its Association with Serum Lipid Levels and Longevity in the Bama Population"	rs4420638	"A>G "	https://pubmed.ncbi.nlm.nih.gov/28486432/	https://www.ncbi.nlm.nih.gov/clinvar/variation/162177/
"Lipid Metabolism"	"Triglyceride Levels"	51085	MLXIPL	"This gene encodes a basic helix-loop-helix leucine zipper transcription factor of the Myc/Max/Mad superfamily. This protein forms a heterodimeric complex and binds and activates, in a glucose-dependent manner, carbohydrate response element (ChoRE) motifs "	https://www.ncbi.nlm.nih.gov/pubmed?LinkName=gene_pubmed&from_uid=51085	"PMID: 29858861"	"Relationship of lipid regulatory gene polymorphisms and dyslipidemia in a pediatric population: the CASPIAN III study"	rs3812316	"C>G "	https://pubmed.ncbi.nlm.nih.gov/29858861/	NA
"Lipid Metabolism"	"Triglyceride Levels"	2646	GCKR	"Glucokinase regulatory protein (GKRP; gene symbol: GCKR) is a rate-limiting factor of glucokinase (GCK), which functions as a key glycolytic enzyme for maintaining glucose homeostasis"	https://www.ncbi.nlm.nih.gov/pubmed?LinkName=gene_pubmed&from_uid=2646	"PMID: 31305457"	"The relationship among GNB3 rs5443, PNPLA3 rs738409, GCKR rs780094 gene polymorphisms, type of maternal gestational weight gain and neonatal outcomes (STROBE-compliant article)"	rs780094	T>C	https://pubmed.ncbi.nlm.nih.gov/31305457/	https://www.ncbi.nlm.nih.gov/clinvar/variation/8751/
"Lipid Metabolism"	"Triglyceride Levels"	348	APOE	"The protein encoded by this gene is a major apoprotein of the chylomicron. It binds to a specific liver and peripheral cell receptor, and is essential for the normal catabolism of triglyceride-rich lipoprotein constituents. This gene maps to chromosome 19"	https://www.ncbi.nlm.nih.gov/pubmed?LinkName=gene_pubmed&from_uid=348	"PMID: 28720344"	"APOE genotype associates with food consumption and body composition to predict dyslipidaemia in Brazilian adults with normal-weight obesity syndrome"	rs7412	C>T	https://pubmed.ncbi.nlm.nih.gov/28720344/	https://www.ncbi.nlm.nih.gov/clinvar/variation/17848/
"Weight Management"	Obesity	79068	FTO	"This gene is a nuclear protein of the AlkB related non-haem iron and 2-oxoglutarate-dependent oxygenase superfamily but the exact physiological function of this gene is not known. Other non-heme iron enzymes function to reverse alkylated Diabetic nephropa"	https://www.ncbi.nlm.nih.gov/pubmed?LinkName=gene_pubmed&from_uid=79068	PMID: 32505845	"Common polymorphisms in MC4R and FTO genes are associated with BMI and metabolic indicators in Mexican children: Differences by sex and genetic ancestry"	rs8050136	"C>A "	https://pubmed.ncbi.nlm.nih.gov/32505845/	NA
"Weight Management"	Obesity	4160	MC4R	"The protein encoded by this gene is a membrane-bound receptor and member of the melanocortin receptor family. The encoded protein interacts with adrenocorticotropic and MSH hormones and is mediated by G proteins. This is an intronless gene. Defects in thi"	https://www.ncbi.nlm.nih.gov/pubmed?LinkName=gene_pubmed&from_uid=4160	"PMID: 32505845"	"Common polymorphisms in MC4R and FTO genes are associated with BMI and metabolic indicators in Mexican children: Differences by sex and genetic ancestry"	rs17782313	T>A,C	https://pubmed.ncbi.nlm.nih.gov/32505845/	https://www.ncbi.nlm.nih.gov/clinvar/variation/225961/
"Weight Management"	Obesity	5468	PPARG	"This gene encodes a member of the peroxisome proliferator-activated receptor (PPAR) subfamily of nuclear receptors. PPARs form heterodimers with retinoid X receptors (RXRs) and these heterodimers regulate transcription of various genes. Three subtypes of "	https://www.ncbi.nlm.nih.gov/pubmed?LinkName=gene_pubmed&from_uid=5468	PMID:9753710	"Obesity associated with a mutation in a genetic regulator of adipocyte differentiation."	rs1800571	C>A	https://www.ncbi.nlm.nih.gov/snp/rs1800571#publications	https://www.ncbi.nlm.nih.gov/clinvar?term=((23169[AlleleID]))
"Weight Management"	Obesity	9370	ADIPOQ	"This gene is expressed in adipose tissue exclusively. It encodes a protein with similarity to collagens X and VIII and complement factor C1q. The encoded protein circulates in the plasma and is involved with metabolic and hormonal processes. Stimulates AM"	https://www.ncbi.nlm.nih.gov/pubmed?LinkName=gene_pubmed&from_uid=9370	"PMID: 30472712"	"Variants in APOA5 and ADIPOQ Moderate Improvements in Metabolic Syndrome during a One-Year Lifestyle Intervention"	rs1501299	"G>C,T "	https://pubmed.ncbi.nlm.nih.gov/30472712/	NA
"Weight Management"	Obesity	116519	APOA5	"The protein encoded by this gene is an apolipoprotein that plays an important role in regulating the plasma triglyceride levels, a major risk factor for coronary artery disease. It is a component of high density lipoprotein and is highly similar to a rat "	https://www.ncbi.nlm.nih.gov/pubmed?LinkName=gene_pubmed&from_uid=116519	"PMID: 30472712"	"Variants in APOA5 and ADIPOQ Moderate Improvements in Metabolic Syndrome during a One-Year Lifestyle Intervention"	rs662799	G>A,C	https://pubmed.ncbi.nlm.nih.gov/30472712/	https://www.ncbi.nlm.nih.gov/clinvar/?term=rs662799
"Weight Management"	Obesity	3953	LEPR	"The protein encoded by this gene belongs to the gp130 family of cytokine receptors that are known to stimulate gene transcription via activation of cytosolic STAT proteins. This protein is a receptor for leptin (an adipocyte-specific hormone that regulate"	https://www.ncbi.nlm.nih.gov/pubmed?LinkName=gene_pubmed&from_uid=3953	"PMID: 31948470"	"Association of the leptin receptor Q223R (rs1137101) polymorphism with obesity measures in Sri Lankans"	rs1137101	A>G,T	https://pubmed.ncbi.nlm.nih.gov/31948470/	https://www.ncbi.nlm.nih.gov/clinvar/variation/8521/
"Weight Management"	Obesity	5443	POMC	"This gene encodes a preproprotein that undergoes extensive, tissue-specific, post-translational processing via cleavage by subtilisin-like enzymes known as prohormone convertases. The encoded protein is synthesized mainly in corticotroph cells of the ante"	https://www.ncbi.nlm.nih.gov/pubmed?LinkName=gene_pubmed&from_uid=5443	"PMID: 26226973"	"Analysis of MC4R rs17782313, POMC rs1042571, APOE-Hha1 and AGRP rs3412352 genetic variants with susceptibility to obesity risk in North Indians"	rs1042571	"G>A "	https://pubmed.ncbi.nlm.nih.gov/26226973/	https://www.ncbi.nlm.nih.gov/clinvar/variation/335352/
"Weight Management"	Obesity	129787	"Near TMEM18"	"The TMEM18 gene codes for a poorly characterized transmembrane protein. One study indicated that this protein is located in the nuclear envelope in neural stem cells. TMEM18 may be involved in cell migration as overexpression of the protein increases the "	https://www.ncbi.nlm.nih.gov/pubmed?LinkName=gene_pubmed&from_uid=129787	"PMID: 32228543"	"Obesity-related loci in TMEM18, CDKAL1 and FAIM2 are associated with obesity and type 2 diabetes in Chinese Han patients"	rs6548238	T>C,G	https://pubmed.ncbi.nlm.nih.gov/32228543/	https://www.ncbi.nlm.nih.gov/clinvar/variation/812169/
CVD	Cardiomyopathy	4000	LMNA	"LMNA produces the major lamin A and C proteins, and the minor A10 and C2 proteins by alternative splicing within exon 10, which are differentially expressed in a developmentally and tissue specific manner."	https://www.ncbi.nlm.nih.gov/pubmed?LinkName=gene_pubmed&from_uid=4000	PMID: 28785654	"Novel linkage of LMNA Single Nucleotide Polymorphism with Dilated Cardiomyopathy in an Indian case study"	rs4641	C>T 	https://pubmed.ncbi.nlm.nih.gov/28785654/	https://www.ncbi.nlm.nih.gov/clinvar/variation/48048/
CVD	"Hypothyroidism "	7849	PAX8	"This gene encodes a member of the paired box (PAX) family of transcription factors. Members of this gene family typically encode proteins that contain a paired box domain, an octapeptide, and a paired-type homeodomain. This nuclear protein is involved in "	https://www.ncbi.nlm.nih.gov/pubmed?LinkName=gene_pubmed&from_uid=7849	"PMID: 9590296"	"PAX8 mutations associated with congenital hypothyroidism caused by thyroid dysgenesis."	rs104893655	G/A	https://pubmed.ncbi.nlm.nih.gov/9590296/	https://www.ncbi.nlm.nih.gov/clinvar?term=((28822[AlleleID]))
CVD	"Hypothyroidism "	1734	DIO2	"'The protein encoded by this gene belongs to the iodothyronine deiodinase family. It catalyzes the conversion of prohormone thyroxine (3,5,3'',5''-tetraiodothyronine, T4) to the bioactive thyroid hormone (3,5,3''-triiodothyronine, T3) by outer ring 5''-de"	https://www.ncbi.nlm.nih.gov/pubmed?LinkName=gene_pubmed&from_uid=1734	"PMID 19190113"	"Common variation in the DIO2 gene predicts baseline psychological well-being and response to combination thyroxine plus triiodothyronine therapy in hypothyroid patients"	rs225014	T>C	https://www.ncbi.nlm.nih.gov/snp/rs225014#publications	NA
