phenotype	traits	gene_id	gene	description	all_publication	pubmed_id	title	snp	observed_genotype	variation_support_paper	clinical_significance
CVD	Cardiomyopathy	4607	MYBPC3	"MYBPC3 encodes the cardiac isoform of myosin-binding protein C. Myosin-binding protein C is a myosin-associated protein found in the cross-bridge-bearing zone (C region) of A bands in striated muscle. MYBPC3, the cardiac isoform, is expressed exclussively"	https://www.ncbi.nlm.nih.gov/pubmed?LinkName=gene_pubmed&from_uid=4607	"PMID: 7493025"	"Mutations in the cardiac myosin binding protein-C gene on chromosome 11 cause familial hypertrophic cardiomyopathy."	rs373746463	C>A,G,T	https://www.ncbi.nlm.nih.gov/snp/rs373746463#publications	https://www.ncbi.nlm.nih.gov/clinvar?term=((23641[AlleleID])OR(51876[AlleleID])OR(51877[AlleleID]))
CVD	"Myocardial Infraction"	79068	FTO	"This gene is a nuclear protein of the AlkB related non-haem iron and 2-oxoglutarate-dependent oxygenase superfamily but the exact physiological function of this gene is not known. Other non-heme iron enzymes function to reverse alkylated Diabetic nephropa"	https://www.ncbi.nlm.nih.gov/pubmed?LinkName=gene_pubmed&from_uid=79068	PMID: 32612360	"Association Metabolic Obesity Phenotypes with Cardiometabolic Index, Atherogenic Index of Plasma and Novel Anthropometric Indices: A Link of FTO-rs9939609 Polymorphism"	rs9939609	T>A 	https://pubmed.ncbi.nlm.nih.gov/32612360/	NA
CVD	"Myocardial Infraction"	100048912	CDKN2B-AS1	"This gene lies adjacent to the tumor suppressor gene CDKN2A in a region that is frequently mutated and deleted in a wide variety of tumors. This gene encodes a cyclin-dependent kinase inhibitor, which forms a complex with CDK4 or CDK6, and prevents the ac"	https://www.ncbi.nlm.nih.gov/pubmed?LinkName=gene_pubmed&from_uid=100048912	PMID: 32011499	"Rs10757274 gene polymorphisms in coronary artery disease: A systematic review and a meta-analysis"	rs10757274	A>C,G,T 	https://pubmed.ncbi.nlm.nih.gov/32011499/	https://www.ncbi.nlm.nih.gov/clinvar/variation/812640/
CVD	"Myocardial Infraction"	6387	CXCL12	"Chemokine (C-X-C motif) ligand 12 (CXCL12), also called stromal cell-derived factor-1 (SDF-1), is one of the members of CXC chemokine family and mostly known for its crucial role in the accumulation of smooth muscle progenitor cells (SPCs). It will trigge"	https://www.ncbi.nlm.nih.gov/pubmed?LinkName=gene_pubmed&from_uid=6387	"PMID: 28614256"	"Association between chemokine CXC ligand 12 gene polymorphism (rs1746048) and coronary heart disease: A MOOSE-compliant meta-analysis"	rs1746048	C>T	https://pubmed.ncbi.nlm.nih.gov/28614256/	NA
CVD	"Myocardial Infraction"	3988	LIPA	"The LIPA gene encodes lysosomal acid lipase (LAL), which hydrolyzes cholesteryl esters and triglycerides in the lysosome of cells to generate free cholesterol and free fatty acids. Any alteration of LAL could produce an accumulation of triglycerides and c"	https://www.ncbi.nlm.nih.gov/pubmed?LinkName=gene_pubmed&from_uid=3988	PMID: 31645127	"Functional Characterization of LIPA (Lysosomal Acid Lipase) Variants Associated With Coronary Artery Disease"	rs1051338	T>A,G 	https://pubmed.ncbi.nlm.nih.gov/31645127/	https://www.ncbi.nlm.nih.gov/clinvar/variation/195049/
CVD	"Myocardial Infraction"	563897	"Near ABO"	"ABO blood group system is associated with cognitive impairment, preeclampsia, bleeding, neoplastic diseases, and even longevity. mechanism of relationship between ABO blood group and venous thrombosis is elucidated, and its major determinants are von Will"	https://pubmed.ncbi.nlm.nih.gov/32093636/	"PMID: 32093636"	"Association of ABO polymorphisms and pancreatic Cancer/ Cardiocerebrovascular disease: a meta-analysis"	rs505922	C>T 	https://pubmed.ncbi.nlm.nih.gov/32093636/	NA
CVD	"Coronary Artery Disease"	6934	TCF7L2	"This gene encodes a high mobility group (HMG) box-containing transcription factor that plays a key role in the Wnt signaling pathway. The protein has been implicated in blood glucose homeostasis. Genetic variants of this gene are associated with increased"	https://www.ncbi.nlm.nih.gov/pubmed?LinkName=gene_pubmed&from_uid=6934	PMID: 31775533	"Genetic variation in TCF7L2 rs7903146 correlating with peripheral arterial disease in long-standing type 2 diabetes"	rs7903146	C>G,T	https://pubmed.ncbi.nlm.nih.gov/31775533/	https://www.ncbi.nlm.nih.gov/clinvar/variation/7413/
CVD	"Coronary Artery Disease"	9370	ADIPOQ	"This gene is expressed in adipose tissue exclusively. It encodes a protein with similarity to collagens X and VIII and complement factor C1q. The encoded protein circulates in the plasma and is involved with metabolic and hormonal processes. Mutations in "	https://www.ncbi.nlm.nih.gov/pubmed?LinkName=gene_pubmed&from_uid=9370	PMID: 31561637	"Associations of SNPs of the ADIPOQ Gene with Serum Adiponectin Levels, Unstable Angina, and Coronary Artery Disease"	rs17300539	G>A	https://pubmed.ncbi.nlm.nih.gov/31561637/	N/A
CVD	"Coronary Artery Disease"	9734	HDAC9	"Histones play a critical role in transcriptional regulation, cell cycle progression, and developmental events. Histone acetylation/deacetylation alters chromosome structure and affects transcription factor access to Diabetic nephropathyA. The protein enco"	https://www.ncbi.nlm.nih.gov/pubmed?LinkName=gene_pubmed&from_uid=9734	PMID: 27494404	"HDAC9 Variant Rs2107595 Modifies Susceptibility to Coronary Artery Disease and the Severity of Coronary Atherosclerosis in a Chinese Han Population"	rs2107595	G>A	https://pubmed.ncbi.nlm.nih.gov/27494404/	N/A
CVD	"Coronary Artery Disease"	1071	CETP	"The protein encoded by this gene is found in plasma, where it is involved in the transfer of cholesteryl ester from high density lipoprotein (HDL) to other lipoproteins. Defects in this gene are a cause of hyperalphalipoproteinemia 1."	https://www.ncbi.nlm.nih.gov/pubmed?LinkName=gene_pubmed&from_uid=1071	PMID: 31739638	"Association of RS708272 ( CETP Gene Variant) with Lipid Profile Parameters and the Risk of Myocardial Infarction in the White Population of Western Siberia"	rs708272	G>A,C	https://pubmed.ncbi.nlm.nih.gov/31739638/	N/A
CVD	"Coronary Artery Disease"	5444	PON1	"This gene encodes a member of the paraoxonase family of enzymes and exhibits lactonase and ester hydrolase activity. Following synthesis in the kidney and liver, the enzyme is secreted into the circulation, where it binds to high density lipoprotein (HDL)"	https://www.ncbi.nlm.nih.gov/pubmed?LinkName=gene_pubmed&from_uid=5444	PMID: 30128909	"Significant association between paraoxonase 1 rs662 polymorphism and coronary heart disease : A meta-analysis in the Chinese population"	rs662	T>A,C,G	https://pubmed.ncbi.nlm.nih.gov/30128909/	https://www.ncbi.nlm.nih.gov/clinvar/variation/13735/
CVD	"Coronary Artery Disease"	375056	MIA3	"The MIA3 encodes for a protein that is shown to be involved in the export of collagen VII and ApoB within cells, and the protein may also play a role in the secretion of collagens I, II, III, IV, VII and IX. This may suggest an association with the risk o"	https://www.ncbi.nlm.nih.gov/pubmed?LinkName=gene_pubmed&from_uid=375056	PMID: 24125424	"Meta-analysis identifies robust association between SNP rs17465637 in MIA3 on chromosome 1q41 and coronary artery disease"	rs17465637	A>C,G,T	https://pubmed.ncbi.nlm.nih.gov/24125424/	N/A
CVD	"Coronary Artery Disease"	7040	TGFB1	"This gene encodes a secreted ligand of the TGF-beta (transforming growth factor-beta) superfamily of proteins. Ligands of this family bind various TGF-beta receptors leading to recruitment and activation of SMAD family transcription factors that regulate "	https://www.ncbi.nlm.nih.gov/pubmed?LinkName=gene_pubmed&from_uid=7040	"PMID: 29115286"	"Genetic predictors associated with diabetic retinopathy in patients with diabetic foot"	rs1800469	A>G	https://pubmed.ncbi.nlm.nih.gov/29115286/	https://www.ncbi.nlm.nih.gov/clinvar/variation/39302/
CVD	"Coronary Artery Disease"	7941	PLA2G7	"The protein encoded by this gene is a secreted enzyme that catalyzes the degradation of platelet-activating factor to biologically inactive products. Defects in this gene are a cause of platelet-activating factor acetylhydrolase deficiency."	https://www.ncbi.nlm.nih.gov/pubmed?LinkName=gene_pubmed&from_uid=7941	PMID: 29728838	"Interaction between nonsynonymous polymorphisms in PLA2G7 gene and smoking on the risk of coronary heart disease in a Chinese population"	rs1805017	C>A,T	https://pubmed.ncbi.nlm.nih.gov/29728838/	https://www.ncbi.nlm.nih.gov/clinvar/variation/56163/
CVD	"Atrial Fibrillation"	183	AGT	"The protein encoded by this gene, pre-angiotensinogen or angiotensinogen precursor, is expressed in the liver and is cleaved by the enzyme renin in response to lowered blood pressure. The protein is involved in maintaining blood pressure and in the pathog"	https://www.ncbi.nlm.nih.gov/pubmed?LinkName=gene_pubmed&from_uid=183	PMID: 32293282	"Genetic forms and pathophysiology of essential arterial hypertension in minor indigenous peoples of Russia"	rs699	A>G	https://pubmed.ncbi.nlm.nih.gov/32293282/	https://www.ncbi.nlm.nih.gov/clinvar/variation/18068/
CVD	Atherosclerosis	2244	FGB	"The protein encoded by this gene is the beta component of fibrinogen, a blood-borne glycoprotein comprised of three pairs of nonidentical polypeptide chains. Following vascular injury, fibrinogen is cleaved by thrombin to form fibrin which is the most abu"	https://www.ncbi.nlm.nih.gov/pubmed?LinkName=gene_pubmed&from_uid=2244	"PMID: 9514419"	"Beta-fibrinogen gene polymorphism (C148-->T) is associated with carotid atherosclerosis: results of the Austrian Stroke Prevention Study"	rs1800787	"C>A / C>T"	https://pubmed.ncbi.nlm.nih.gov/9514419/	NA
CVD	Stroke	9734	HDAC9	"Histones play a critical role in transcriptional regulation, cell cycle progression, and developmental events. Histone acetylation/deacetylation alters chromosome structure and affects transcription factor access to Diabetic nephropathy. The protein encod"	https://www.ncbi.nlm.nih.gov/pubmed?LinkName=gene_pubmed&from_uid=9734	PMID: 29651704	"HDAC9 Polymorphism Alters Blood Gene Expression in Patients with Large Vessel Atherosclerotic Stroke"	rs2107595	G>A	https://pubmed.ncbi.nlm.nih.gov/29651704/	N/A
CVD	Stroke	154	ADRB2	"This gene encodes beta-2-adrenergic receptor which is a member of the G protein-coupled receptor superfamily. This receptor is directly associated with one of its ultimate effectors, the class C L-type calcium channel Ca(V)1.2. This receptor-channel compl"	https://www.ncbi.nlm.nih.gov/pubmed?LinkName=gene_pubmed&from_uid=154	PMID: 31699066	"Association of β2-adrenergic receptor gene polymorphisms (rs1042713, rs1042714, rs1042711) with asthma risk: a systematic review and updated meta-analysis"	rs1042713 	G>A,C	https://pubmed.ncbi.nlm.nih.gov/31699066/	https://www.ncbi.nlm.nih.gov/clinvar/variation/225937/
CVD	Stroke	9734	HDAC9	"Histones play a critical role in transcriptional regulation, cell cycle progression, and developmental events. Histone acetylation/deacetylation alters chromosome structure and affects transcription factor access to Diabetic nephropathyA. The protein enco"	https://www.ncbi.nlm.nih.gov/pubmed?LinkName=gene_pubmed&from_uid=9734	PMID: 29651704	"HDAC9 Polymorphism Alters Blood Gene Expression in Patients with Large Vessel Atherosclerotic Stroke"	rs2107595	G>A	https://pubmed.ncbi.nlm.nih.gov/29651704/	N/A
CVD	Stroke	4815	NINJ2	"'NINJ2 encodes ninjurin2, a member of the ''ninjurin'' or nerve-injury-induced protein family. It plays a role in nerve regeneration and may increase the risk of stroke by altering brain response to ischemic injury.'"	https://www.ncbi.nlm.nih.gov/pubmed?LinkName=gene_pubmed&from_uid=4815	PMID: 24664524	"Association between NINJ2 gene polymorphisms and ischemic stroke: a family-based case-control study"	rs11833579	G>A	https://pubmed.ncbi.nlm.nih.gov/24664524/	N/A
CVD	"Coronary Heart Diseases"	7040	TGFB1	"This gene encodes a secreted ligand of the TGF-beta (transforming growth factor-beta) superfamily of proteins. Ligands of this family bind various TGF-beta receptors leading to recruitment and activation of SMAD family transcription factors that regulate "	https://www.ncbi.nlm.nih.gov/pubmed?LinkName=gene_pubmed&from_uid=7040	"PMID: 29115286"	"Genetic predictors associated with diabetic retinopathy in patients with diabetic foot"	rs1800469	A>G	https://pubmed.ncbi.nlm.nih.gov/29115286/	https://www.ncbi.nlm.nih.gov/clinvar/variation/39302/
CVD	"Coronary Heart Diseases"	217	ALDH2	"This protein belongs to the aldehyde dehydrogenase family of proteins. Aldehyde dehydrogenase is the second enzyme of the major oxidative pathway of alcohol metabolism. Two major liver isoforms of aldehyde dehydrogenase, cytosolic and mitochondrial, can b"	https://www.ncbi.nlm.nih.gov/pubmed?LinkName=gene_pubmed&from_uid=217	PMID: 31591379	"Genome-wide association study of alcohol dependence in male Han Chinese and cross-ethnic polygenic risk score comparison"	rs671	G>A	https://pubmed.ncbi.nlm.nih.gov/31591379/	https://www.ncbi.nlm.nih.gov/clinvar/variation/18390/
CVD	"Coronary Heart Diseases"	25902	MTHFD1L	"The protein encoded by this gene is involved in the synthesis of tetrahydrofolate (THF) in the mitochondrion. THF is important in the de novo synthesis of purines and thymidylate and in the regeneration of methionine from homocysteine."	https://www.ncbi.nlm.nih.gov/pubmed?LinkName=gene_pubmed&from_uid=25902	PMID: 25809277	"Rs6922269 marker at the MTHFD1L gene predict cardiovascular mortality in males after acute coronary syndrome"	rs6922269	G>A	https://pubmed.ncbi.nlm.nih.gov/25809277/	N/A
"Vascular Diseases"	Hypertension	183	AGT	"The protein encoded by this gene, pre-angiotensinogen or angiotensinogen precursor, is expressed in the liver and is cleaved by the enzyme renin in response to lowered blood pressure. The protein is involved in maintaining blood pressure and in the pathog"	https://www.ncbi.nlm.nih.gov/pubmed?LinkName=gene_pubmed&from_uid=183	PMID: 32293282	"Genetic forms and pathophysiology of essential arterial hypertension in minor indigenous peoples of Russia"	rs699	A>G	https://pubmed.ncbi.nlm.nih.gov/32293282/	https://www.ncbi.nlm.nih.gov/clinvar/variation/18068/
"Vascular Diseases"	Hypertension	185	AGTR1	"Angiotensin II is a potent vasopressor hormone and a primary regulator of aldosterone secretion. It is an important effector controlling blood pressure and volume in the cardiovascular system. It acts through at least two types of receptors. This gene enc"	https://www.ncbi.nlm.nih.gov/pubmed?LinkName=gene_pubmed&from_uid=185	PMID: 30920415	"Angiotensin II Type 1 Receptor rs5186 Gene Variant Predicts Incident NAFLD and Associated Hypertension: Role of Dietary Fat-Induced Pro-Inflammatory Cell Activation"	rs5186	A>C	https://pubmed.ncbi.nlm.nih.gov/30920415/	
"Vascular Diseases"	Hypertension	118	ADD1	"Alpha-adducin is a protein that in humans is encoded by the ADD1 gene.  Alpha- and beta-adducin include a protease-resistant N-terminal region and a protease-sensitive, hydrophilic C-terminal region. Adducin binds with high affinity to Ca(2+)/calmodulin a"	https://www.ncbi.nlm.nih.gov/pubmed?LinkName=gene_pubmed&from_uid=118	PMID: 30552709	"Association between α-adducin rs4961 polymorphism and hypertension: A meta-analysis based on 40 432 subjects"	rs4961	G>A,T	https://pubmed.ncbi.nlm.nih.gov/30552709/	
Diabetes	"Diabetic Neuropathy"	9722	NOS1AP	"NOS1AP encodes a cytosolic protein that binds to neuronal nitric oxide synthase (gene-NOS1 or protein-nNOS) via an N-terminal phosphotyrosine binding (PDZ) domain. NOS1AP stabilizes nNOS potentiating its subcellular influence. As a result NOS1AP enhances "	https://www.ncbi.nlm.nih.gov/pubmed?LinkName=gene_pubmed&from_uid=9722	PMID: 28827735	"The genetic variation rs12143842 in NOS1AP increases idiopathic ventricular tachycardia risk in Chinese Han populations"	rs12143842 	C>G,T	https://pubmed.ncbi.nlm.nih.gov/28827735/	
Diabetes	"Diabetic Neuropathy"	7351	UCP2	"The uncoupling protein 2 (UCP2) is a member of the mitochondrial inner membrane carrier family and is expressed in many tissues including white adipose tissue, liver, kidney, pancreatic islets, macrophages and retinal endothelial cells and pericytes. UCP2"	https://www.ncbi.nlm.nih.gov/pubmed?LinkName=gene_pubmed&from_uid=7351	"PMID: 25396419"	"Investigation of variants in UCP2 in Chinese type 2 diabetes and diabetic retinopathy"	rs660339	"G>A "	https://pubmed.ncbi.nlm.nih.gov/25396419/	https://www.ncbi.nlm.nih.gov/clinvar/variation/130697/
Diabetes	"Diabetic Nephropathy"	5468	PPARG	"This gene encodes a member of the peroxisome proliferator-activated receptor (PPAR) subfamily of nuclear receptors. PPARs form heterodimers with retinoid X receptors (RXRs) and these heterodimers regulate transcription of various genes. Three subtypes of "	https://www.ncbi.nlm.nih.gov/pubmed?LinkName=gene_pubmed&from_uid=5468	PMID:9753710	"Obesity associated with a mutation in a genetic regulator of adipocyte differentiation."	rs1800571	C>A	https://www.ncbi.nlm.nih.gov/snp/rs1800571#publications	https://www.ncbi.nlm.nih.gov/clinvar?term=((23169[AlleleID]))
Diabetes	"Diabetic Nephropathy"	9370	ADIPOQ	"This gene is expressed in adipose tissue exclusively. It encodes a protein with similarity to collagens X and VIII and complement factor C1q. The encoded protein circulates in the plasma and is involved with metabolic and hormonal processes. Mutations in "	https://www.ncbi.nlm.nih.gov/pubmed?LinkName=gene_pubmed&from_uid=9370	"PMID: 30472712"	"Variants in APOA5 and ADIPOQ Moderate Improvements in Metabolic Syndrome during a One-Year Lifestyle Intervention"	rs1501299	"G>C,T "	https://pubmed.ncbi.nlm.nih.gov/30472712/	NA
Diabetes	"Diabetic Nephropathy"	185	AGTR1	"The protein encoded by this gene, pre-angiotensinogen or angiotensinogen precursor, is expressed in the liver and is cleaved by the enzyme renin in response to lowered blood pressure. The protein is involved in maintaining blood pressure and in the pathog"	https://www.ncbi.nlm.nih.gov/pubmed?LinkName=gene_pubmed&from_uid=185	PMID: 30920415	"Angiotensin II Type 1 Receptor rs5186 Gene Variant Predicts Incident NAFLD and Associated Hypertension: Role of Dietary Fat-Induced Pro-Inflammatory Cell Activation"	rs5186	A>C	https://pubmed.ncbi.nlm.nih.gov/30920415/	
Diabetes	"Diabetic Nephropathy"	1535	CYBA	"Cytochrome b is comprised of a light chain (alpha) and a heavy chain (beta). This gene encodes the light, alpha subunit which has been proposed as a primary component of the microbicidal oxidase system of phagocytes. Mutations in this gene are associated "	https://www.ncbi.nlm.nih.gov/pubmed?LinkName=gene_pubmed&from_uid=1535	"PMID: 29924645"	"Association of Polymorphisms in CYBA, SOD1, and CAT Genes with Type 1 Diabetes and Diabetic Peripheral Neuropathy in Children and Adolescents"	rs4673	"A>G,T "	https://pubmed.ncbi.nlm.nih.gov/29924645/	https://www.ncbi.nlm.nih.gov/clinvar/variation/2263/
Diabetes	"Diabetic Nephropathy"	7040	TGFB1	"This gene encodes a secreted ligand of the TGF-beta (transforming growth factor-beta) superfamily of proteins. Ligands of this family bind various TGF-beta receptors leading to recruitment and activation of SMAD family transcription factors that regulate "	https://www.ncbi.nlm.nih.gov/pubmed?LinkName=gene_pubmed&from_uid=7040	"PMID: 32362625"	"Transforming growth factor-β1 gene polymorphism as a potential risk factor in Turkish patients with laryngeal squamous cell carcinoma"	rs1800471	"C>G,T "	https://pubmed.ncbi.nlm.nih.gov/32362625/	NA
Diabetes	"Diabetic Nephropathy"	6647	"Near SOD1"	"The protein encoded by this gene binds copper and zinc ions and is one of two isozymes responsible for destroying free superoxide radicals in the body. The encoded isozyme is a soluble cytoplasmic protein, acting as a homodimer to convert naturally-occuri"	https://www.ncbi.nlm.nih.gov/pubmed?LinkName=gene_pubmed&from_uid=6647	PMID: 30909159	"Interactions between plasma copper concentrations and SOD1 gene polymorphism for impaired glucose regulation and type 2 diabetes"	rs2070424	A>C,G,T	https://pubmed.ncbi.nlm.nih.gov/30909159/	N/A
Diabetes	"Diabetic Nephropathy"	6647	SOD1	"The protein encoded by this gene binds copper and zinc ions and is one of two isozymes responsible for destroying free superoxide radicals in the body. The encoded isozyme is a soluble cytoplasmic protein, acting as a homodimer to convert naturally-occuri"	https://www.ncbi.nlm.nih.gov/pubmed?LinkName=gene_pubmed&from_uid=6647	PMID: 30909159	"Interactions between plasma copper concentrations and SOD1 gene polymorphism for impaired glucose regulation and type 2 diabetes"	rs2070424	A>C,G,T	https://pubmed.ncbi.nlm.nih.gov/30909159/	N/A
Diabetes	"Diabetic cataract"	5467	PPARD	"This gene encodes a member of the peroxisome proliferator-activated receptor (PPAR) family. The encoded protein is thought to function as an integrator of transcriptional repression and nuclear receptor signaling. PPARs are involved in the development of "	https://www.ncbi.nlm.nih.gov/pubmed?LinkName=gene_pubmed&from_uid=5467	"PMID: 29776318"	"PPARD rs7770619 polymorphism in a Korean population: Association with plasma malondialdehyde and impaired fasting glucose or newly diagnosed type 2 diabetes"	rs7770619	"C>T "	https://pubmed.ncbi.nlm.nih.gov/29776318/	N/A
Diabetes	"Diabetic cataract"	4739	NEDD9	"The protein encoded by this gene is a member of the CRK-associated substrates family. Members of this family are adhesion docking molecules that mediate protein-protein interactions for signal transduction pathways. This protein is a focal adhesion protei"	https://www.ncbi.nlm.nih.gov/pubmed?LinkName=gene_pubmed&from_uid=4739	"PMID: 21315566"	"Type 2 diabetes and polymorphisms on chromosome 9p21: a meta-analysis"	rs10811661	"T>A,C "	https://pubmed.ncbi.nlm.nih.gov/21315566/	
Diabetes	"Foot Ulcers"	4982	TNFRSF11B	"The protein encoded by this gene is a member of the TNF-receptor superfamily. This protein is an osteoblast-secreted decoy receptor that functions as a negative regulator of bone resorption. This protein specifically binds to its ligand, osteoprotegerin l"	https://www.ncbi.nlm.nih.gov/pubmed?LinkName=gene_pubmed&from_uid=4982	"PMID: 29501268"	"Significant Association between OPG/TNFRSF11B Variant and Common Complex Ischemic Stroke"	rs3134069	A>C,G	https://pubmed.ncbi.nlm.nih.gov/29501268/	NA
Diabetes	"Foot Ulcers"	7124	"Near TNF"	"This gene encodes a multifunctional proinflammatory cytokine that belongs to the tumor necrosis factor (TNF) superfamily. This cytokine is mainly secreted by macrophages. It can bind to, and thus functions through its receptors TNFRSF1A/TNFR1 and TNFRSF1B"	https://www.ncbi.nlm.nih.gov/pubmed?LinkName=gene_pubmed&from_uid=7124	"PMID: 31803921"	"The association of TNF-α -308G/A and -238G/A polymorphisms with type 2 diabetes mellitus: a meta-analysis"	rs1800629	"G>A "	https://pubmed.ncbi.nlm.nih.gov/23527193/	https://www.ncbi.nlm.nih.gov/clinvar/variation/225964/
Diabetes	"Diabetic Retinopathy"	6934	TCF7L2	"This gene encodes a high mobility group (HMG) box-containing transcription factor that plays a key role in the Wnt signaling pathway. The protein has been implicated in blood glucose homeostasis. Genetic variants of this gene are associated with increased"	https://www.ncbi.nlm.nih.gov/pubmed?LinkName=gene_pubmed&from_uid=6934	"PMID: 31775533"	"Genetic variation in TCF7L2 rs7903146 correlating with peripheral arterial disease in long-standing type 2 diabetes"	rs7903146	C>G,T	https://pubmed.ncbi.nlm.nih.gov/31775533/	https://www.ncbi.nlm.nih.gov/clinvar/variation/7413/
Diabetes	"Diabetic Retinopathy"	5468	PPARG	"This gene encodes a member of the peroxisome proliferator-activated receptor (PPAR) subfamily of nuclear receptors. PPARs form heterodimers with retinoid X receptors (RXRs) and these heterodimers regulate transcription of various genes. Three subtypes of "	https://www.ncbi.nlm.nih.gov/pubmed?LinkName=gene_pubmed&ncbi_mmode=std&from_uid=5468	"PMID: 29703528"	"Replication of a Gene-Diet Interaction at CD36, NOS3 and PPARG in Response to Omega-3 Fatty Acid Supplements on Blood Lipids: A Double-Blind Randomized Controlled Trial"	rs1801282	"C>G "	https://pubmed.ncbi.nlm.nih.gov/29703528/	https://www.ncbi.nlm.nih.gov/clinvar/variation/130019/
Diabetes	"Diabetic Retinopathy"	9370	ADIPOQ	"This gene is expressed in adipose tissue exclusively. It encodes a protein with similarity to collagens X and VIII and complement factor C1q. The encoded protein circulates in the plasma and is involved with metabolic and hormonal processes. Mutations in "	https://www.ncbi.nlm.nih.gov/pubmed?LinkName=gene_pubmed&from_uid=9370	"PMID: 30467975"	"ADIPOQ, KCNJ11 and TCF7L2 polymorphisms in type 2 diabetes in Kyrgyz population: A case-control study"	rs1501299	"G>C,T "	https://pubmed.ncbi.nlm.nih.gov/30467975/	NA
Diabetes	"Diabetic Retinopathy"	3383	"CD54 (ICAM1)"	"Intercellular adhesion molecule-1 (ICAM1) is a biomarker for endothelial cell dysfunction and inflammation that mediates leucocyte influx and persistent retinal leukostasis, retinal vascular leakage, capillary non-perfusion and endothelial cell injury and"	https://www.ncbi.nlm.nih.gov/pubmed?LinkName=gene_pubmed&from_uid=3383	"PMID: 30419874"	"Association between diabetic retinopathy in type 2 diabetes and the ICAM-1 rs5498 polymorphism: a meta-analysis of case-control studies"	rs5498	"A>G "	https://pubmed.ncbi.nlm.nih.gov/30419874/	NA
